{
  "id": "exp_2026_03_24_002",
  "org": "sample-org",
  "repo": "sample-app",
  "kind": "exception",
  "title": "Direct patch allowed for rollback hotfixes",
  "claim": "Direct billing patching is acceptable only for emergency rollback hotfixes.",
  "scope": {
    "paths": ["src/billing/hotfix/**"],
    "task_types": ["hotfix"]
  },
  "evidence": [
    {
      "type": "incident",
      "ref": "billing-rollback-sample"
    }
  ],
  "source": {
    "author": "Sample Engineer",
    "session": "2026-03-24-hotfix-review"
  },
  "confidence": 0.66,
  "status": "active",
  "updated_at": "2026-03-24T09:00:00.000Z"
}
