{
  "id": "exp_2026_03_24_001",
  "org": "sample-org",
  "repo": "sample-app",
  "kind": "rule",
  "title": "Route billing updates through adapter",
  "claim": "Do not patch billing logic directly in the service layer; route changes through the adapter first.",
  "scope": {
    "paths": ["src/billing/**"],
    "task_types": ["bugfix", "refactor"]
  },
  "evidence": [
    {
      "type": "mr",
      "ref": "!42"
    }
  ],
  "source": {
    "author": "Sample Engineer",
    "session": "2026-03-24-billing-fix"
  },
  "confidence": 0.74,
  "status": "active",
  "updated_at": "2026-03-24T08:00:00.000Z"
}
